{
  "$schema": "http://json-schema.org/draft-07/schema#",
  "$id": "https://evolve-loop/docs/architecture/phase-descriptor.schema.json",
  "title": "Evolve Loop Phase Descriptor",
  "description": "The unified, declarative definition of a pipeline phase (a registry entry in docs/architecture/phase-registry.json:phases[], or an operator overlay at .evolve/phases/<name>/phase.json). Mirrors go/internal/phasespec.PhaseSpec. This schema is a LINT AID consumed by `evolve phase lint`; it is NOT a load-time gate (the runtime parser is tolerant + fail-open, ADR-0035). The deliverable contract (artifact path, kind, required sections, verdict vocab) is DERIVED from these fields by phasecontract.FromSpec \u2014 there is no separate contract file.",
  "type": "object",
  "required": [
    "name"
  ],
  "additionalProperties": false,
  "properties": {
    "name": {
      "type": "string",
      "pattern": "^[a-z][a-z0-9-]*$",
      "description": "Lowercase kebab-case identifier. Safe as a filename, agent suffix, and routing token."
    },
    "kind": {
      "type": "string",
      "enum": [
        "llm",
        "native",
        "command"
      ],
      "default": "llm",
      "description": "Runner kind. Only 'llm' is executable today; 'native'/'command' are reserved. Orthogonal to the deliverable's markdown/json shape (that is derived from outputs.files[0]'s extension)."
    },
    "archetype": {
      "type": "string",
      "enum": [
        "plan",
        "build",
        "evaluate",
        "control"
      ],
      "description": "Composition archetype for advisor selection and the integrity floor. Inferred from name when omitted. Note: distinct from the registry 'role' key (the agent/profile name)."
    },
    "optional": {
      "type": "boolean",
      "description": "User (overlay) phases MUST be optional:true \u2014 a user phase can never displace or satisfy the build->audit->ship floor."
    },
    "agent": {
      "type": "string",
      "description": "Persona basename under agents/ (without .md). Defaults to evolve-<name>."
    },
    "model": {
      "type": "string",
      "description": "Model tier or sentinel. Defaults to 'auto'."
    },
    "writes_source": {
      "type": "boolean",
      "description": "Whether the phase writes production code (runs in the worktree under the role-gate)."
    },
    "description": {
      "type": "string",
      "description": "One line: what the phase produces. Rendered into the phase inventory and the advisor's SELECT catalog (ADR-0038)."
    },
    "when_to_use": {
      "type": "string",
      "description": "The signal/goal that should trigger SELECTing this phase \u2014 the advisor's primary routing hint. Keep it under ~140 characters; the catalog renderer truncates beyond that."
    },
    "categories": {
      "type": "array",
      "items": {
        "type": "string",
        "enum": [
          "bugfix",
          "feature",
          "refactor",
          "security",
          "performance",
          "release",
          "docs"
        ]
      },
      "description": "Goal types this phase serves; drives the inventory's category_index and the advisor's goal-type relevance filter. Unknown values are a lint warning, never a load failure."
    },
    "enabled": {
      "type": "string"
    },
    "enable_var": {
      "type": "string",
      "description": "Env var that toggles the phase."
    },
    "inputs": {
      "$ref": "#/definitions/io"
    },
    "outputs": {
      "$ref": "#/definitions/io"
    },
    "prompt_context": {
      "type": "array",
      "items": {
        "type": "string"
      }
    },
    "classify": {
      "type": "object",
      "additionalProperties": false,
      "description": "Declarative verdict rules. require_sections drives the DERIVED contract's required markdown headings; verdict_on_pass opts an evaluate phase into the PASS/FAIL/WARN/SKIPPED verdict vocabulary.",
      "properties": {
        "require_sections": {
          "type": "array",
          "items": {
            "type": "string"
          }
        },
        "fail_if_empty": {
          "type": "boolean"
        },
        "fail_if_signal": {
          "type": "object",
          "additionalProperties": {
            "type": "string"
          }
        },
        "verdict_on_pass": {
          "type": "string",
          "enum": [
            "PASS",
            "FAIL",
            "WARN",
            "SKIPPED"
          ]
        },
        "require_failure_context": {
          "type": "boolean",
          "description": "ADR-0039: a FAIL/WARN sentinel must carry the structured failure block (class/defects/evidence_paths) or the contract gate re-dispatches with a correction."
        },
        "verdict_from_sentinel": {
          "type": "string",
          "enum": [
            "",
            "shadow",
            "enforce"
          ],
          "default": "",
          "description": "ADR-0091 rollout stage for letting a JUDGMENT phase's own stated verdict decide. Absent = off: structure decides and the stated verdict is discarded (legacy). 'shadow' = route as before and write judgment-verdict-shadow-<phase>.json recording what the stated verdict would have made it. 'enforce' = the verdict parsed from the canonical evolve-verdict sentinel is authoritative, failing open to the structural verdict when none is readable. Structure is still checked first, and an unknown value is a hard FAIL at classify time. A phase declaring this key must also be listed in judgmentTeachingPhases so its FAIL teaches the next cycle."
        }
      }
    },
    "routing": {
      "type": "object",
      "description": "Conditional/dynamic-edge triggers evaluated against the digested signal plane. insert_when adds the phase; skip_when removes it.",
      "properties": {
        "insert_when": {
          "type": "array",
          "items": {
            "$ref": "#/definitions/condition"
          }
        },
        "skip_when": {
          "type": "array",
          "items": {
            "$ref": "#/definitions/condition"
          }
        }
      }
    },
    "gates": {
      "type": "object",
      "additionalProperties": false,
      "properties": {
        "in": {
          "type": "string"
        },
        "out": {
          "type": "string"
        }
      }
    },
    "after": {
      "type": "string",
      "description": "Slot this phase right after the named phase in the routing order. Empty defaults to the pre-audit slot."
    },
    "stage": {
      "type": "string",
      "enum": ["pre-build", "post-build"],
      "description": "Where the phase sits relative to build. A pre-build phase (a red-first Evaluate phase such as bug-reproduction) is refused, with a routing-defect signal, when its slot would fall after build."
    },
    "on_pass": {
      "type": "string"
    },
    "on_fail": {
      "type": "string"
    },
    "effects": {
      "type": "array",
      "items": {
        "type": "string"
      },
      "description": "Lifecycle effects the persona performs outside its workspace (e.g. inbox-claim); each binds to one deterministic check in the declared-deliverables gate."
    }
  },
  "definitions": {
    "io": {
      "type": "object",
      "additionalProperties": false,
      "properties": {
        "files": {
          "type": "array",
          "items": {
            "type": "string"
          }
        },
        "signals": {
          "type": "array",
          "items": {
            "type": "string"
          }
        },
        "agent_owed": {
          "type": "array",
          "items": {
            "type": "string"
          },
          "description": "Secondary output files (basenames of files[1:]) the phase agent must write; files[0] is always owed. Verified by the declared-deliverables gate (ADR-0100)."
        },
        "harness_produced": {
          "type": "array",
          "items": {
            "type": "string"
          },
          "description": "Secondary output files a harness component writes; declared for completeness, excluded from the gate. With agent_owed, partitions files[1:]."
        },
        "derived_from": {
          "type": "object",
          "additionalProperties": {
            "type": "string"
          },
          "description": "Maps an agent_owed secondary to the primary output (basename of files[0]) the host derives it from before any judge when the agent leaves it absent or empty (ADR-0106). A declaration without a registered deriver fails the deliverable tests."
        }
      }
    },
    "condition": {
      "type": "object",
      "additionalProperties": false,
      "required": [
        "field",
        "op",
        "value"
      ],
      "properties": {
        "field": {
          "type": "string",
          "description": "Signal field path, e.g. build.files_touched."
        },
        "op": {
          "type": "string",
          "enum": [
            "eq",
            "==",
            "ne",
            "!=",
            "gt",
            ">",
            "gte",
            ">=",
            "lt",
            "<",
            "lte",
            "<="
          ]
        },
        "value": {}
      }
    }
  }
}
